{
  "schema": 1,
  "command": "doctor",
  "status": "blocked",
  "commit": "9b8e12f3b6e802d2103c5ebeb5ff89a08c8d85ce",
  "version": null,
  "checks": [
    {
      "id": "docker.daemon",
      "ok": false,
      "detail": "Docker CLI is installed but its daemon is unavailable; image and benchmark dispatch remain blocked"
    },
    {
      "id": "github.environment.rc",
      "ok": true,
      "detail": "configured"
    },
    {
      "id": "github.environment.rc.deployment_refs",
      "ok": false,
      "detail": "custom deployment policy has no allowed branch/tag refs; configure the intended workflow dispatch ref"
    },
    {
      "id": "github.environment.rc.reviewers",
      "ok": true,
      "detail": "required reviewer configured"
    },
    {
      "id": "github.environment.release",
      "ok": true,
      "detail": "configured"
    },
    {
      "id": "github.environment.release.deployment_refs",
      "ok": false,
      "detail": "custom deployment policy has no allowed branch/tag refs; configure the intended workflow dispatch ref"
    },
    {
      "id": "github.environment.release.reviewers",
      "ok": true,
      "detail": "required reviewer configured"
    },
    {
      "id": "github.secret.CARGO_REGISTRY_TOKEN",
      "ok": false,
      "detail": "missing; configure with `gh secret set CARGO_REGISTRY_TOKEN --repo logannye/rosalind`"
    },
    {
      "id": "repository.origin",
      "ok": true,
      "detail": "https://github.com/logannye/rosalind.git"
    },
    {
      "id": "tool.actionlint",
      "ok": false,
      "detail": "1.7.7\ninstalled by downloading from release page\nbuilt with go1.23.4 compiler for darwin/arm64"
    },
    {
      "id": "tool.cargo",
      "ok": true,
      "detail": "cargo 1.95.0 (f2d3ce0bd 2026-03-21)"
    },
    {
      "id": "tool.cargo-public-api",
      "ok": true,
      "detail": "cargo-public-api 0.50.1"
    },
    {
      "id": "tool.docker",
      "ok": true,
      "detail": "Docker version 28.4.0, build d8eb465f86"
    },
    {
      "id": "tool.gh",
      "ok": true,
      "detail": "gh version 2.87.0 (2026-02-18)\nhttps://github.com/cli/cli/releases/tag/v2.87.0"
    },
    {
      "id": "tool.git",
      "ok": true,
      "detail": "git version 2.50.1 (Apple Git-155)"
    },
    {
      "id": "tool.public-api-toolchain",
      "ok": true,
      "detail": "rustc 1.97.0-nightly (a5c825cd8 2026-04-14)"
    },
    {
      "id": "tool.release-toolchain",
      "ok": true,
      "detail": "rustc 1.95.0 (59807616e 2026-04-14)"
    },
    {
      "id": "tool.shellcheck",
      "ok": true,
      "detail": "ShellCheck - shell script analysis tool\nversion: 0.10.0\nlicense: GNU General Public License, version 3\nwebsite: https://www.shellcheck.net"
    },
    {
      "id": "tool.wasm-pack",
      "ok": true,
      "detail": "wasm-pack 0.14.0"
    }
  ],
  "blockers": [
    "docker.daemon: Docker CLI is installed but its daemon is unavailable; image and benchmark dispatch remain blocked",
    "github.environment.rc.deployment_refs: custom deployment policy has no allowed branch/tag refs; configure the intended workflow dispatch ref",
    "github.environment.release.deployment_refs: custom deployment policy has no allowed branch/tag refs; configure the intended workflow dispatch ref",
    "github.secret.CARGO_REGISTRY_TOKEN: missing; configure with `gh secret set CARGO_REGISTRY_TOKEN --repo logannye/rosalind`",
    "tool.actionlint: 1.7.7\ninstalled by downloading from release page\nbuilt with go1.23.4 compiler for darwin/arm64"
  ],
  "actions": [
    "configure CARGO_REGISTRY_TOKEN without exposing its value",
    "configure protected rc and release environments",
    "install missing pinned maintainer tools"
  ],
  "contract_fingerprint": null,
  "plan_id": "21d60f176af77938e4be398e9bb31a9b78ab2f089355e68559616fbbe27fad07",
  "metadata": {
    "actionlint_version": "1.7.12",
    "cargo_public_api_version": "0.50.1",
    "foundation_test_baseline": "336",
    "jsonschema_version": "4.23.0",
    "msrv": "1.83.0",
    "public_api_toolchain": "nightly-2026-04-15",
    "release_toolchain": "1.95.0",
    "shellcheck_version": "0.10.0",
    "wasm_pack_version": "0.14.0"
  }
}
